{
  "version": "anatomy-v1",
  "metadata": {
    "target": "https://example.com/",
    "mode": "extension",
    "timestamp": "2026-04-22T19:10:00Z",
    "tools": ["anatomy-extension@0.2.0"]
  },
  "regions": [
    {
      "id": "header",
      "n": 1,
      "name": "Header",
      "layer": "ui",
      "selector": "header",
      "kind": "sem"
    }
  ],
  "chains": [],
  "layers": {
    "ui":    { "color": "#c084fc" },
    "api":   { "color": "#f59e0b" },
    "ext":   { "color": "#818cf8" },
    "lib":   { "color": "#22c55e" },
    "state": { "color": "#a855f7" }
  }
}
