{
  "version": "anatomy-v1",
  "metadata": {
    "target": "https://example.com/",
    "mode": "extension",
    "timestamp": "2026-04-22T19:10:00Z",
    "tools": ["anatomy-extension@0.2.0"]
  },
  "regions": [
    {
      "id": "header",
      "n": 1,
      "name": "Header",
      "layer": "ui",
      "selector": "header",
      "kind": "sem",
      "bounds": { "x": 0, "y": 0, "w": 1440, "h": 64 }
    },
    {
      "id": "signup-form",
      "n": 2,
      "name": "Signup form",
      "layer": "api",
      "selector": "form#signup",
      "detection": "form",
      "desc": "POST /api/signup",
      "fetches": [
        {
          "method": "POST",
          "url": "/api/signup",
          "status": 200,
          "contentType": "application/json",
          "ts": 1761166212345
        }
      ]
    }
  ],
  "chains": [
    {
      "id": "chain-post-api-signup",
      "nodes": [
        {
          "n": 3,
          "layer": "api",
          "label": "POST /api/signup",
          "detail": "200 · json",
          "probe": {
            "method": "POST",
            "status": 200,
            "contentType": "application/json"
          }
        },
        {
          "n": 4,
          "layer": "ext",
          "label": "api.example.com",
          "detail": "inferred from probe"
        }
      ]
    }
  ],
  "layers": {
    "ui":    { "color": "#c084fc" },
    "api":   { "color": "#f59e0b" },
    "ext":   { "color": "#818cf8" },
    "lib":   { "color": "#22c55e" },
    "state": { "color": "#a855f7" }
  }
}
